{
  "name": "SAGAR SHRINIVAS SOMANI",
  "email": "sagarss 20.mba@coep.ac.in",
  "phone": "8668488633",
  "location": "",
  "skills": [
    "C/C++ STL",
    "Python",
    "Finance/Banking",
    "Java"
  ],
  "education": [
    {
      "degree": "MBA, Master of Business Administration",
      "institution": "MGM's Jawaharlal Nehru",
      "year": "2022"
    },
    {
      "degree": "UG",
      "institution": "Dr. Babasaheb Ambedkar Marathwada University",
      "year": "2019"
    },
    {
      "degree": "Class XII",
      "institution": "Podar International School",
      "year": "2012"
    }
  ],
  "experience": [
    {
      "company": "Accenture",
      "role": "Associate Software Engineer",
      "start_date": "Dec 2019",
      "end_date": "Jan 2021",
      "description": []
    },
    {
      "company": "",
      "role": "Fund Raising Intern - Finance",
      "start_date": "Aug 2021",
      "end_date": "Present",
      "description": []
    },
    {
      "company": "",
      "role": "Market Research Analyst - MBA - Market Research",
      "start_date": "Apr 2021",
      "end_date": "May 2021",
      "description": []
    }
  ],
  "projects": [],
  "summary": "",
  "certificates": [
    {
      "name": "The Finance and Banking Fundamental Program",
      "issuer": "FLIP",
      "year": ""
    }
  ],
  "courses": [],
  "raw_text": "SAGAR SHRINIVAS SOMANI\nCourse :MBA, Master of Business Administration, 2022\nEmail :sagarss 20.mba@coep.ac.in\nMobile :8668488633\nCGPA :7.58\nACADEMIC DETAILS\nCOURSE SPECIALIZATION INSTITUTE/COLLEGE BOARD/UNIVERSITY SCORE YEAR\nInformation MGM's Jawaharlal Nehru\nUG Dr. Babasaheb Ambedkar Marathwada University 70 % 2019\nTechnology Engineering College, Aurangabad\nCLASS Maharashtra State Board of Secondary and Higher 61.38\nElectronics Deogiri College, Aurangabad 2014\nXII Secondary \n\n## Education\n (MSBSHSE) %\nCLASS X Podar International School ICSE 81.4 % 2012\nSubjects / Electives\nTechnical Proficiency C/C++ STL,Python,Finance/Banking,Java\nSUMMER INTERNSHIP / WORK \n\n## Experience\n\nAssociate Software Engineer, Accenture Dec 2019 - Jan 2021\n\n## Projects\n\nFund Raising Intern - Finance Aug 2021 - Present\nMarket Research Analyst - MBA - Market Research Apr 2021 - May 2021\nPOSITION OF RESPONSIBILITY\nHead Co-ordinator - Swayambhu Mar 2018 - May 2018\nTreasurer - JITSA Jul 2017 - Jul 2018\nEXTRA CURRICULAR ACTIVITIES\nFounder ar Buzzworld.in\nFounder of Buzzworld where write about business problems which an organisation faced and what methods and ways did they apply to\novercome them.\nhttps://buzzworld.in/author/sagar-somani/\nAWARDS AND RECOGNITIONS\n\n## Certifications\n\nCERTIFICATION CERTIFYING AUTHORITY DESCRIPTION\nThe Finance and Banking Fundamental Program FLIP\nCOMPETITIONS\nCONFERENCES AND WORKSHOPS\nTEST SCORES\nTEST NAME DATE OF EXAM SCORE\nPATENTS\nPUBLICATIONS\nSCHOLARSHIPS\nVOLUNTEER \n\n## Experience\n\nLANGUAGES KNOWN\nMarwari,Marathi,Hindi,English",
  "salary": {
    "current_ctc_lpa": null,
    "expected_ctc_lpa": null
  }
}