{
  "name": "Sagar Shrinivas Somani",
  "email": "sagarss 20.mba@coep.ac.in",
  "phone": "8668488633",
  "location": "",
  "skills": [
    "C/C++ Stl",
    "Finance/Banking",
    "Java",
    "Python"
  ],
  "education": [
    {
      "degree": "Master's Degree in Engineering",
      "institution": "MGM's Jawaharlal Nehru",
      "year_start": "2022-01",
      "year_end": ""
    },
    {
      "degree": "Ug",
      "institution": "Dr. Babasaheb Ambedkar Marathwada University",
      "year_start": "2019-01",
      "year_end": ""
    },
    {
      "degree": "Class Xii",
      "institution": "Podar International School",
      "year_start": "2012-01",
      "year_end": ""
    }
  ],
  "experience": [
    {
      "company": "Accenture",
      "role": "Associate Software Engineer",
      "start_date": "2019-12",
      "end_date": "2021-01",
      "description": []
    },
    {
      "company": "",
      "role": "Fund Raising Intern - Finance",
      "start_date": "2021-08",
      "end_date": "2026-01",
      "description": []
    },
    {
      "company": "",
      "role": "Market Research Analyst - Mba - Market Research",
      "start_date": "2021-04",
      "end_date": "2021-05",
      "description": []
    }
  ],
  "projects": [
    {
      "name": "Fund Raising Intern",
      "description": "Finance Aug 2021 - Present"
    },
    {
      "name": "Market Research Analyst",
      "description": "MBA - Market Research Apr 2021 - May 2021"
    }
  ],
  "summary": "",
  "certificates": [
    "The Finance and Banking Fundamental Program"
  ],
  "courses": [
    "MBA",
    "Master of Business Administration",
    "2022",
    "Mobile :8668488633"
  ],
  "raw_text": "SAGAR SHRINIVAS SOMANI\nCourse :MBA, Master of Business Administration, 2022\nEmail :sagarss 20.mba@coep.ac.in\nMobile :8668488633\nCGPA :7.58\nACADEMIC DETAILS\nCOURSE SPECIALIZATION INSTITUTE/COLLEGE BOARD/UNIVERSITY SCORE YEAR\nInformation MGM's Jawaharlal Nehru\nUG Dr. Babasaheb Ambedkar Marathwada University 70 % 2019\nTechnology Engineering College, Aurangabad\nCLASS Maharashtra State Board of Secondary and Higher 61.38\nElectronics Deogiri College, Aurangabad 2014\nXII Secondary \n\n## Education\n (MSBSHSE) %\nCLASS X Podar International School ICSE 81.4 % 2012\nSubjects / Electives\nTechnical Proficiency C/C++ STL,Python,Finance/Banking,Java\nSUMMER INTERNSHIP / WORK \n\n## Experience\n\nAssociate Software Engineer, Accenture Dec 2019 - Jan 2021\n\n## Projects\n\nFund Raising Intern - Finance Aug 2021 - Present\nMarket Research Analyst - MBA - Market Research Apr 2021 - May 2021\nPOSITION OF RESPONSIBILITY\nHead Co-ordinator - Swayambhu Mar 2018 - May 2018\nTreasurer - JITSA Jul 2017 - Jul 2018\nEXTRA CURRICULAR ACTIVITIES\nFounder ar Buzzworld.in\nFounder of Buzzworld where write about business problems which an organisation faced and what methods and ways did they apply to\novercome them.\nhttps://buzzworld.in/author/sagar-somani/\nAWARDS AND RECOGNITIONS\n\n## Certifications\n\nCERTIFICATION CERTIFYING AUTHORITY DESCRIPTION\nThe Finance and Banking Fundamental Program FLIP\nCOMPETITIONS\nCONFERENCES AND WORKSHOPS\nTEST SCORES\nTEST NAME DATE OF EXAM SCORE\nPATENTS\nPUBLICATIONS\nSCHOLARSHIPS\nVOLUNTEER \n\n## Experience\n\nLANGUAGES KNOWN\nMarwari,Marathi,Hindi,English",
  "salary": {
    "current_ctc_lpa": null,
    "expected_ctc_lpa": 86684.89
  },
  "relevant_experience_map": {
    "AI": 4.42
  },
  "total_experience_years": 5.58
}