{
  "name": "Priyanka Agarwal",
  "email": "priyanka.agarwalbgn 19@gmail.com",
  "phone": "9337181684",
  "location": "Sundargarh, Odisha, India",
  "skills": [
    "Agile",
    "Angular",
    "Reactjs",
    "HTML",
    "CSS",
    "JavaScript",
    "Bootstrap",
    "ReactJS",
    "Tailwind CSS",
    "ROR",
    "Java",
    "MySQL",
    "jQuery",
    "Android",
    "Node.js",
    "MongoDB",
    "Jira",
    "GitHub",
    "Bitbucket",
    "Figma"
  ],
  "education": [
    {
      "degree": "Master of Computer Applications",
      "institution": "SUIIT",
      "year": "06/2017 - 07/2020"
    },
    {
      "degree": "University Rank in Graduation",
      "institution": "Sambalpur University, Odisha",
      "year": "06/2014 - 06/2017"
    }
  ],
  "experience": [
    {
      "company": "DispatchTrack India Pvt Ltd",
      "role": "JUNIOR SOFTWARE ENGINEER",
      "start_date": "07/2022",
      "end_date": "07/2023",
      "description": [
        "Streamlined project management processes by implementing Agile methodologies, resulting in a 25% reduction in time-to-market and a 15% increase in team productivity.",
        "Leveraged Angular 10+ to implement and enhance features, resulting in improved functionality and user experiences.",
        "Seamlessly converted ROR code to Angular 13 for superior results!",
        "Spearheaded bug-fixing initiatives, ensuring application stability, and playing a key role in localization efforts for enhanced global accessibility, reducing customer support issues, and satisfying diverse user needs."
      ]
    },
    {
      "company": "Chipmonk Technologies Pvt Ltd",
      "role": "UI DEVELOPER (Intern)",
      "start_date": "01/2022",
      "end_date": "07/2023",
      "description": [
        "Demonstrated bug resolution expertise, led impactful UI improvements, and collaborated seamlessly for user-friendly enhancements, enhancing overall satisfaction!",
        "Street Light Management System (01/2022 - 07/2022)"
      ]
    },
    {
      "company": "Paramore Technologies Pvt Ltd",
      "role": "SOFTWARE QA TESTER (Intern)",
      "start_date": "02/2021",
      "end_date": "03/2021",
      "description": [
        "Performed thorough testing for web and mobile applications, identified/reporting bugs, and collaborated with senior developers to enhance organizational efficiency!"
      ]
    }
  ],
  "projects": [
    {
      "name": "WeStride and WeStride Plus",
      "description": "Experienced in translating Figma to React.js and UI Tailwind CSS ROR development, converting old applications to new ones with responsive UI and existing feature enhancements."
    },
    {
      "name": "Transpotation Management System(DTD)",
      "description": "Demonstrated bug resolution expertise, led impactful UI improvements, and collaborated seamlessly for user-friendly enhancements, enhancing overall satisfaction!"
    },
    {
      "name": "Street Light Management System",
      "description": ""
    }
  ],
  "summary": "Software Engineer proficient in Agile, Angular (10+), Reactjs, and efficient bug resolution, dedicated with strong problem-solving and attention to detail. Streamlined project management for a 25% reduction in time-to-market, ensuring top-notch web application delivery.",
  "certificates": [
    {
      "name": "React-The Complete Guide(incl Hooks, React Router, Redux)",
      "issuer": "Udemy",
      "year": "11/2021 - 12/2021"
    },
    {
      "name": "Angular-The Complete Guide(2022 Edition)",
      "issuer": "Udemy",
      "year": "11/2021 - 12/2021"
    }
  ],
  "courses": [],
  "raw_text": "Priyanka Agarwal\nSoftware Engineer\n1-2 years \n\n## Experience\n as Software Engineer proficient in Agile, Angular (10+), Reactjs, and efficient bug\nresolution, dedicated with strong problem-solving \n\n## Skills\n and attention to detail. Streamlined project\nmanagement for a 25% reduction in time-to-market, ensuring top-notch web application delivery.\npriyanka.agarwalbgn 19@gmail.com 9337181684\nSundargarh, Odisha, India linkedin.com/in/priyanka-agarwal-a 3011610 b\nWORK \n\n## Experience\n \n\n## Skills\n\nFull Stack Developer HTML CSS\nWeStride\nJavaScript Angular\n04/2024 - Present, Remote\nReactJS Bootstrap\n\n## Achievements\n/Tasks\nExperienced in translating Figma to React.js and UI Tailwind CSS ROR\ndevelopment, converting old applications to new ones with\nJava MySQL\nresponsive UI and existing feature enhancements, and\nskilled in debugging for application stability and enhanced jQuery Android\nuser \n\n## Experience\n!\nNode.js MongoDB\nJUNIOR SOFTWARE ENGINEER\nJira GitHub\nDispatchTrack India Pvt Ltd\nBitbucket Figma\n07/2022 - 07/2023, Remote\n\n## Achievements\n/Tasks\nStreamlined project management processes by\n\n## Achievements\n\nimplementing Agile methodologies, resulting in a 25%\nreduction in time-to-market and a 15% increase in team\nUniversity Rank in Graduation (06/2014 - 06/2017)\nproductivity!\nRanked 4 th in Sambalpur University, Odisha, for demonstrating\nLeveraged Angular 10+ to implement and enhance features, academic excellence and commitment. Awarded Best Graduate by Viksh\nresulting in improved functionality and user experiences. Degree College, displaying a strong academic track record and\ndedication to success.\nSeamlessly converted ROR code to Angular 13 for superior\nresults!\nSpearheaded bug-fixing initiatives, ensuring application\n\n## Projects\n\nstability, and playing a key role in localization efforts for\nenhanced global accessibility, reducing customer support WeStride and WeStride Plus (04/2024 - Present)\nissues, and satisfying diverse user needs!\n\n## Education\n Software\nUI DEVELOPER (Intern) Transpotation Management System(DTD Private Fleet)\nChipmonk Technologies Pvt Ltd (12/2022 - 07/2023)\nLogistics, Last Mile Software,B 2 B Application\n01/2022 - 07/2022, Remote\n\n## Achievements\n/Tasks Transpotation Management System(DTD)\nDemonstrated bug resolution expertise, led impactful UI (07/2022 - 11/2022)\nimprovements, and collaborated seamlessly for user-friendly Logistics, Last Mile Software,B 2 C Application\nenhancements, enhancing overall satisfaction!\nStreet Light Management System (01/2022 - 07/2022)\n(Chipmonk)- Ludhiana, Faridabad, Streetcom, User Activity\nSOFTWARE QA TESTER (Intern)\nParamore Technologies Pvt Ltd\n02/2021 - 03/2021, Remote CERTIFICATES\n\n## Achievements\n/Tasks\nReact-The Complete Guide(incl Hooks, React Router,\nPerformed thorough testing for web and mobile\nRedux) (11/2021 - 12/2021)\napplications, identified/reporting bugs, and collaborated\nwith senior developers to enhance organizational efficiency! Udemy\nAngular-The Complete Guide(2022 Edition)\n(11/2021 - 12/2021)\n\n## Education\n Udemy\nMaster of Computer Applications\nSUIIT INTERESTS\n06/2017 - 07/2020, Burla\nListening to Music Watching Movies",
  "salary": {
    "current_ctc_lpa": null,
    "expected_ctc_lpa": null
  }
}